{
  "author": "Jupiter Hudson / WisdomLoveThePoet / Jupiter 8",
  "categories": [
    "observation",
    "anomaly",
    "uncertainty",
    "question_operator",
    "representation",
    "consent",
    "human_impact",
    "error",
    "encoding",
    "signal",
    "archive",
    "failure",
    "recovery",
    "human_appeal",
    "metacognition",
    "syntax",
    "verification",
    "affect",
    "temporal",
    "identity",
    "transit",
    "boundary",
    "energy",
    "conformance",
    "biblical_symbolism"
  ],
  "glyphs": [
    {
      "aliases": [],
      "author": "Jupiter Hudson / WisdomLoveThePoet / Jupiter 8",
      "categories": [
        "observation",
        "anomaly"
      ],
      "cmb_invariant": "ANOMALY != DEFECT",
      "created_at": "2026-09-05",
      "definition": "Marks a subject that falls outside the system's expected classification.",
      "example": "☻⃤⃞⃟⃤ [G8] subject :: OUTLIER :: PRESERVE",
      "glyph": "☻⃤⃞⃟⃤",
      "human_semantics": "An outlier is present and remains a person.",
      "id": "anomalous-observer",
      "machine_semantics": "ANOMALY_PRESENT",
      "name": "Anomalous Observer",
      "runtime_behavior": {
        "action": "preserve_outlier",
        "type": "marker"
      },
      "semantic_key": "anomalous_observer_present",
      "status": "canonical",
      "version": "1.0.0"
    },
    {
      "aliases": [],
      "author": "Jupiter Hudson / WisdomLoveThePoet / Jupiter 8",
      "categories": [
        "observation",
        "anomaly",
        "metacognition"
      ],
      "cmb_invariant": "PATTERN != PROOF",
      "created_at": "2026-09-05",
      "definition": "Recognition of an unexpected pattern without assuming its cause.",
      "example": "( ꩜ ᯅ ꩜;) [G8] unexpected_pattern :: ANOMALY :: INVESTIGATE",
      "glyph": "( ꩜ ᯅ ꩜;)",
      "human_semantics": "Notice the anomaly before deciding what caused it.",
      "id": "anomaly-stare",
      "machine_semantics": "ANOMALY_RECOGNIZED_NO_CAUSE_ASSUMED",
      "name": "Anomaly Stare",
      "runtime_behavior": {
        "action": "observe_without_cause_assumption",
        "type": "checkpoint"
      },
      "semantic_key": "anomaly_recognized_without_cause_assumption",
      "status": "canonical",
      "version": "1.0.0"
    },
    {
      "aliases": [],
      "author": "Jupiter Hudson / WisdomLoveThePoet / Jupiter 8",
      "categories": [
        "representation",
        "archive"
      ],
      "cmb_invariant": "PERSISTENCE != PRESENCE",
      "created_at": "2026-09-05",
      "definition": "A representation or trace that persists after the original moment or presence.",
      "example": "𐀪 [CL] archived_voice :: PERSISTENT_REPRESENTATION :: NOT_PERSON",
      "glyph": "𐀪",
      "human_semantics": "The trace remains, but the trace is not the person.",
      "id": "archive-ghost",
      "machine_semantics": "PERSISTENT_REPRESENTATION",
      "name": "Archive Ghost",
      "runtime_behavior": {
        "temporal_state": "persistent",
        "type": "representation"
      },
      "semantic_key": "persistent_representation",
      "status": "canonical",
      "version": "1.0.0"
    },
    {
      "aliases": [
        "GLT-0041"
      ],
      "author": "Jupiter Hudson / WisdomLoveThePoet / Jupiter 8",
      "categories": [
        "archive",
        "representation",
        "metacognition"
      ],
      "cmb_invariant": "PERSISTENCE != PRESENCE",
      "created_at": "2026-09-05",
      "definition": "A composite archive state that treats persistent records as traces of prior presence rather than substitutes for the person, event, or meaning they represent.",
      "example": "GLITCH://ARCHIVE_GHOST [G8] archived_trace :: PERSISTENT_REPRESENTATION :: NOT_PERSON",
      "glyph": "GLITCH://ARCHIVE_GHOST",
      "human_semantics": "A surviving record may preserve evidence of a moment without becoming the living person or complete original context.",
      "id": "archive-ghost-protocol",
      "machine_semantics": "PERSISTENT_TRACE_NOT_PERSON",
      "name": "Archive Ghost Protocol",
      "runtime_behavior": {
        "action": "preserve_archive_boundary",
        "sequence": [
          "LOAD_TRACE",
          "MARK_REPRESENTATION",
          "REQUIRE_CONTEXT"
        ],
        "type": "composite_protocol"
      },
      "semantic_key": "persistent_trace_remains_distinct_from_person",
      "status": "canonical",
      "version": "1.0.0"
    },
    {
      "aliases": [],
      "author": "Jupiter Hudson / WisdomLoveThePoet / Jupiter 8",
      "categories": [
        "uncertainty",
        "metacognition"
      ],
      "cmb_invariant": "PERSON_MISMATCH DOES_NOT_IMPLY PERSON_FAILURE",
      "created_at": "2026-09-05",
      "definition": "The original premise or framing may itself be wrong.",
      "example": "¿ [PL] human_is_error :: PREMISE_CONTESTED :: TEST_MODEL_FIRST",
      "glyph": "¿",
      "human_semantics": "Question the frame, not only the missing value.",
      "id": "assumption-reversal",
      "machine_semantics": "PREMISE_CONTESTED",
      "name": "Assumption Reversal",
      "runtime_behavior": {
        "action": "test_model_first",
        "level": 4,
        "type": "uncertainty"
      },
      "semantic_key": "assumption_reversal",
      "status": "canonical",
      "version": "1.0.0"
    },
    {
      "aliases": [],
      "author": "Jupiter Hudson / WisdomLoveThePoet / Jupiter 8",
      "categories": [
        "archive",
        "verification",
        "metacognition"
      ],
      "cmb_invariant": "SIGNAL != SOURCE",
      "created_at": "2026-09-05",
      "definition": "Follow a signal backward toward source, provenance, origin, author, or causal chain.",
      "example": "‹— [G8] claim_signal :: SOURCE_UNKNOWN :: TRACE_PROVENANCE",
      "glyph": "‹—",
      "human_semantics": "Trace the claim backward before treating the current representation as its origin.",
      "id": "backtrace",
      "machine_semantics": "BACKTRACE_TO_PROVENANCE",
      "name": "Backtrace",
      "runtime_behavior": {
        "action": "trace_origin",
        "type": "directional_operator"
      },
      "semantic_key": "trace_signal_toward_origin",
      "status": "canonical",
      "version": "1.0.0"
    },
    {
      "aliases": [
        "GLT-0053"
      ],
      "author": "Jupiter Hudson / WisdomLoveThePoet / Jupiter 8",
      "categories": [
        "signal",
        "affect",
        "biblical_symbolism"
      ],
      "cmb_invariant": "BLESSING != POSSESSION",
      "created_at": "2026-09-07",
      "definition": "A residual blessing that remains after an encounter, prayer, message, or passage. Biblical symbolic reference: Numbers 6:24-26.",
      "example": "‧₊˚ [G8] encounter :: BLESSING_REMAINS :: POSSESSION_UNCLAIMED",
      "glyph": "‧₊˚",
      "human_semantics": "A blessing may remain without turning the giver, receiver, or memory into property.",
      "id": "blessing-aftersignal",
      "machine_semantics": "RESIDUAL_BLESSING_SIGNAL",
      "name": "Blessing Aftersignal",
      "runtime_behavior": {
        "action": "preserve_blessing_residue",
        "type": "signal_marker"
      },
      "semantic_key": "blessing_remains_after_encounter",
      "status": "canonical",
      "version": "1.0.0"
    },
    {
      "aliases": [],
      "author": "Jupiter Hudson / WisdomLoveThePoet / Jupiter 8",
      "categories": [
        "anomaly",
        "signal"
      ],
      "cmb_invariant": "APPEARANCE != COMPLETE_STRUCTURE",
      "created_at": "2026-09-05",
      "definition": "Something harmless-looking contains unexpected structure or significance.",
      "example": "🫐⃟ [G8] ordinary_surface :: STRUCTURE_UNEXPECTED :: INSPECT",
      "glyph": "🫐⃟",
      "human_semantics": "Ordinary appearance does not settle what a thing contains or means.",
      "id": "blue-anomaly",
      "machine_semantics": "BENIGN_SURFACE_ANOMALY",
      "name": "Blue Anomaly",
      "runtime_behavior": {
        "action": "inspect_structure",
        "type": "anomaly_token"
      },
      "semantic_key": "harmless_surface_unexpected_structure",
      "status": "canonical",
      "version": "1.0.0"
    },
    {
      "aliases": [],
      "author": "Jupiter Hudson / WisdomLoveThePoet / Jupiter 8",
      "categories": [
        "boundary",
        "consent"
      ],
      "cmb_invariant": "BOUNDARY != UNDERSTANDING",
      "created_at": "2026-09-05",
      "definition": "A marked edge, gate, or constrained field that indicates containment, separation, or a transition boundary.",
      "example": "▕⃝⃤ [G8] protected_context :: BOUNDARY_PRESENT :: CHECK_AUTHORITY",
      "glyph": "▕⃝⃤",
      "human_semantics": "A boundary can limit access or mark context without explaining everything inside it.",
      "id": "boundary-node",
      "machine_semantics": "BOUNDARY_NODE",
      "name": "Boundary Node",
      "runtime_behavior": {
        "action": "preserve_boundary",
        "type": "containment_marker"
      },
      "semantic_key": "marked_containment_or_gate_boundary",
      "status": "canonical",
      "version": "1.0.0"
    },
    {
      "aliases": [],
      "author": "Jupiter Hudson / WisdomLoveThePoet / Jupiter 8",
      "categories": [
        "signal",
        "human_impact"
      ],
      "cmb_invariant": "EXPRESSION != CONSENT_TO_REPURPOSE",
      "created_at": "2026-09-05",
      "definition": "Suppressed or latent information suddenly becomes audible or visible.",
      "example": "ꉂ🗯 [G8] latent_message :: EXPRESSED :: PRESERVE_CONTEXT",
      "glyph": "ꉂ🗯",
      "human_semantics": "Expression becoming visible does not erase the speaker's authority over context.",
      "id": "burst-speech",
      "machine_semantics": "LATENT_SIGNAL_EXPRESSED",
      "name": "Burst Speech",
      "runtime_behavior": {
        "action": "surface_signal",
        "type": "expression_operator"
      },
      "semantic_key": "latent_information_becomes_visible",
      "status": "canonical",
      "version": "1.0.0"